### ISSUE TITLE
TLS errors on 5.4 with default MICROPY_GC_INITIAL_HEAP_SIZE

### ISSUE THREAD

**Issue by chaseadam** [micropython/micropython#16650]
### Port, board and/or hardware

esp32 port

### MicroPython version

```
➜  esp32 git:(master) git describe --dirty
v1.24.0-224-ga4ab84768
```

### Reproduction

Making single requests to 2 different TLS endpoints (which have small payloads).

```
➜  esp32 git:(master) ✗ idf.py --version
ESP-IDF v5.4
...
Chip is ESP32-D0WDQ6 (revision v0.0)
Features: WiFi, BT, Dual Core, Coding Scheme None
Crystal is 40MHz
```

### Expected behaviour

IDF 5.3 was stable without change to MICROPY_GC_INITIAL_HEAP_SIZE

```
➜  esp32 git:(master) idf.py --version
ESP-IDF v5.3
```

### Observed behaviour

I was getting various intermittent lock up (including no ping responses via network to device) or OSError with TLS HTTP requests:
(-17040, 'MBEDTLS_ERR_RSA_PUBLIC_FAILED+MBEDTLS_ERR_MPI_ALLOC_FAILED')
(-29312, 'MBEDTLS_ERR_SSL_CONN_EOF')
[Errno 104] ECONNRESET

Workaround:  Adjusting MICROPY_GC_INITIAL_HEAP_SIZE to 52 (from 56) none of these errors triggered. Errors triggered if I had the value set to 54 as well.

### Additional Information

It is unstable on 5.3.2 as well, but I noted it is not in the "approved" IDF versions. I am not sure if the patch version matters, but because 5.2 and 5.2.2 are explicitly listed, it makes me think they are. Unfortunately, IDF does not have a 5.3.0, so I think micropython esp32 port just lists 5.3. May be worth indicating that supported patch versions will be explicitly listed.

### Code of Conduct

Yes, I agree

**Comment by dpgeorge** [comment]
> ### Reproduction
> 
> Making single requests to 2 different TLS endpoints (which have small payloads).

Can you please provide a Python code sample which triggers the error?

**Comment by chaseadam** [comment]
it is a bit of a cobbled together mess, but this reproduces a lockup on a raw ESP32 module:
https://github.com/chaseadam/PlasticPlayerRedux/tree/micropython-issue-16650

```
➜  esp32 git:(master) git describe --dirty
v1.24.0-224-ga4ab84768
➜  esp32 git:(master) make BOARD=ESP32_GENERIC BOARD_VARIANT=OTA FROZEN_MANIFEST=${HOME}/git/PlasticPlayerRedux/manifest.py
➜  esp32 git:(master) ESPTOOL_PORT=/dev/ttyUSB0 python -m esptool --chip esp32 -b 460800 --before default_reset --after hard_reset write_flash --flash_mode dio --flash_size 4MB --flash_freq 40m 0x1000 build-ESP32_GENERIC-OTA/bootloader/bootloader.bin 0x8000 build-ESP32_GENERIC-OTA/partition_table/partition-table.bin 0xd000 build-ESP32_GENERIC-OTA/ota_data_initial.bin 0x10000 build-ESP32_GENERIC-OTA/micropython.bin
esptool.py v4.8.1
Serial port /dev/ttyUSB0
Connecting....
Chip is ESP32-D0WDQ6 (revision v0.0)
Features: WiFi, BT, Dual Core, Coding Scheme None
Crystal is 40MHz
```

I modified the flow a bit to remove requirement to interact with the device to trigger it.

All required libraries are in the manifest and frozen into the image.

Copy over boot.py and main.py.

Skip the WIFI setup by creating a `config.json` with contents:
```
{"ssid": "<SSID>", "psk": "<PSK>"}
```

`tcpdump` from the router where this traffic passes through showing the lock up from the network side:

```
15:36:02.726912 IP 192.168.5.172.63539 > 35.186.224.24.443: Flags [R.], seq 3244877987, ack 3397142613, win 32790, length 0
15:36:04.393912 IP 192.168.5.172.7406 > 192.168.5.1.53: 42226+ A? accounts.spotify.com. (38)
15:36:04.404452 IP 192.168.5.1.53 > 192.168.5.172.7406: 42226 2/0/0 CNAME edge-web.dual-gslb.spotify.com., A 35.186.224.24 (87)
15:36:04.411395 IP 192.168.5.172.63540 > 35.186.224.24.443: Flags [S], seq 3353017010, win 5760, options [mss 1440], length 0
15:36:04.422863 IP 35.186.224.24.443 > 192.168.5.172.63540: Flags [S.], seq 98823943, ack 3353017011, win 65535, options [mss 1412], length 0
15:36:04.426908 IP 192.168.5.172.63540 > 35.186.224.24.443: Flags [.], ack 1, win 5760, length 0
15:36:04.432859 IP 192.168.5.172.63540 > 35.186.224.24.443: Flags [P.], seq 1:246, ack 1, win 5760, length 245
15:36:04.444373 IP 35.186.224.24.443 > 192.168.5.172.63540: Flags [.], ack 246, win 65535, length 0
15:36:04.446623 IP 35.186.224.24.443 > 192.168.5.172.63540: Flags [.], seq 1:1413, ack 246, win 65535, length 1412
15:36:04.446715 IP 35.186.224.24.443 > 192.168.5.172.63540: Flags [P.], seq 1413:2049, ack 246, win 65535, length 636
15:36:04.446778 IP 35.186.224.24.443 > 192.168.5.172.63540: Flags [P.], seq 2049:3403, ack 246, win 65535, length 1354
15:36:04.449555 IP 192.168.5.172.63540 > 35.186.224.24.443: Flags [.], ack 2049, win 3712, length 0
15:36:04.453179 IP 192.168.5.172.63540 > 35.186.224.24.443: Flags [.], ack 3403, win 5413, length 0
15:36:09.526904 ARP, Request who-has 192.168.5.172 tell 192.168.5.1, length 28
15:36:10.550885 ARP, Request who-has 192.168.5.172 tell 192.168.5.1, length 28
15:36:11.574881 ARP, Request who-has 192.168.5.172 tell 192.168.5.1, length 28
15:36:14.444075 ARP, Request who-has 192.168.5.172 tell 192.168.5.1, length 28
15:36:15.446891 ARP, Request who-has 192.168.5.172 tell 192.168.5.1, length 28
15:36:16.470881 ARP, Request who-has 192.168.5.172 tell 192.168.5.1, length 28
15:36:17.506009 ARP, Request who-has 192.168.5.172 tell 192.168.5.1, length 28
15:36:18.518899 ARP, Request who-has 192.168.5.172 tell 192.168.5.1, length 28
15:36:19.542899 ARP, Request who-has 192.168.5.172 tell 192.168.5.1, length 28
15:36:20.578287 ARP, Request who-has 192.168.5.172 tell 192.168.5.1, length 28
15:36:21.590881 ARP, Request who-has 192.168.5.172 tell 192.168.5.1, length 28
15:36:22.614881 ARP, Request who-has 192.168.5.172 tell 192.168.5.1, length 28
15:36:23.650004 ARP, Request who-has 192.168.5.172 tell 192.168.5.1, length 28
15:36:24.662881 ARP, Request who-has 192.168.5.172 tell 192.168.5.1, length 28
15:36:25.686883 ARP, Request who-has 192.168.5.172 tell 192.168.5.1, length 28
15:36:26.721987 ARP, Request who-has 192.168.5.172 tell 192.168.5.1, length 28
15:36:27.734894 ARP, Request who-has 192.168.5.172 tell 192.168.5.1, length 28
15:36:28.758879 ARP, Request who-has 192.168.5.172 tell 192.168.5.1, length 28
15:36:29.793967 ARP, Request who-has 192.168.5.172 tell 192.168.5.1, length 28
15:36:30.806884 ARP, Request who-has 192.168.5.172 tell 192.168.5.1, length 28
15:36:31.830875 ARP, Request who-has 192.168.5.172 tell 192.168.5.1, length 28
15:36:32.866039 ARP, Request who-has 192.168.5.172 tell 192.168.5.1, length 28
15:36:33.878890 ARP, Request who-has 192.168.5.172 tell 192.168.5.1, length 28
15:36:34.902889 ARP, Request who-has 192.168.5.172 tell 192.168.5.1, length 28
15:36:35.938386 ARP, Request who-has 192.168.5.172 tell 192.168.5.1, length 28
15:36:36.950884 ARP, Request who-has 192.168.5.172 tell 192.168.5.1, length 28
15:36:37.974879 ARP, Request who-has 192.168.5.172 tell 192.168.5.1, length 28
15:36:39.010037 ARP, Request who-has 192.168.5.172 tell 192.168.5.1, length 28
15:36:40.022882 ARP, Request who-has 192.168.5.172 tell 192.168.5.1, length 28
15:36:41.046879 ARP, Request who-has 192.168.5.172 tell 192.168.5.1, length 28
15:36:42.082358 ARP, Request who-has 192.168.5.172 tell 192.168.5.1, length 28
15:36:43.094885 ARP, Request who-has 192.168.5.172 tell 192.168.5.1, length 28
15:36:44.118883 ARP, Request who-has 192.168.5.172 tell 192.168.5.1, length 28
15:36:45.154004 ARP, Request who-has 192.168.5.172 tell 192.168.5.1, length 28
15:36:46.166880 ARP, Request who-has 192.168.5.172 tell 192.168.5.1, length 28
15:36:47.190883 ARP, Request who-has 192.168.5.172 tell 192.168.5.1, length 28
15:36:48.226034 ARP, Request who-has 192.168.5.172 tell 192.168.5.1, length 28
15:36:49.238881 ARP, Request who-has 192.168.5.172 tell 192.168.5.1, length 28
15:36:50.262883 ARP, Request who-has 192.168.5.172 tell 192.168.5.1, length 28
15:36:51.297999 ARP, Request who-has 192.168.5.172 tell 192.168.5.1, length 28
15:36:52.310873 ARP, Request who-has 192.168.5.172 tell 192.168.5.1, length 28
15:36:53.334907 ARP, Request who-has 192.168.5.172 tell 192.168.5.1, length 28
15:36:53.753967 ARP, Request who-has 192.168.5.172 tell 192.168.5.172, length 46
15:36:53.754053 IP 35.186.224.24.443 > 192.168.5.172.63540: Flags [F.], seq 3403, ack 246, win 65535, length 0
15:36:53.754077 IP 35.186.224.24.443 > 192.168.5.172.63540: Flags [F.], seq 3403, ack 246, win 65535, length 0
15:36:53.754096 IP 35.186.224.24.443 > 192.168.5.172.63540: Flags [F.], seq 3403, ack 246, win 65535, length 0
15:36:54.395125 IP 35.186.224.24.443 > 192.168.5.172.63540: Flags [F.], seq 3403, ack 246, win 65535, length 0
15:36:57.914823 IP 35.186.224.24.443 > 192.168.5.172.63540: Flags [F.], seq 3403, ack 246, win 65535, length 0
15:36:58.152367 IP 192.168.5.172.63540 > 35.186.224.24.443: Flags [.], ack 3404, win 5412, length 0
15:36:58.934879 ARP, Request who-has 192.168.5.172 tell 192.168.5.1, length 28
15:36:59.494989 ARP, Reply 192.168.5.172 is-at 30:ae:a4:<>, length 46
```


this is the traffic of same code with smaller MICROPY_GC_INITIAL_HEAP_SIZE:

```
15:39:27.038984 ARP, Request who-has 192.168.5.172 tell 192.168.5.20, length 46
15:39:28.062909 ARP, Request who-has 192.168.5.172 tell 192.168.5.20, length 46
15:39:29.086973 ARP, Request who-has 192.168.5.172 tell 192.168.5.20, length 46
15:39:30.112039 ARP, Request who-has 192.168.5.172 tell 192.168.5.20, length 46
15:39:31.134901 ARP, Request who-has 192.168.5.172 tell 192.168.5.20, length 46
15:39:32.159918 ARP, Request who-has 192.168.5.172 tell 192.168.5.20, length 46
15:39:33.182999 ARP, Request who-has 192.168.5.172 tell 192.168.5.20, length 46
15:39:34.206961 ARP, Request who-has 192.168.5.172 tell 192.168.5.20, length 46
15:39:35.230924 ARP, Request who-has 192.168.5.172 tell 192.168.5.20, length 46
15:39:36.256022 ARP, Request who-has 192.168.5.172 tell 192.168.5.20, length 46
15:39:37.278938 ARP, Request who-has 192.168.5.172 tell 192.168.5.20, length 46
15:39:38.302907 ARP, Request who-has 192.168.5.172 tell 192.168.5.20, length 46
15:39:39.326922 ARP, Request who-has 192.168.5.172 tell 192.168.5.20, length 46
15:39:39.497019 IP 192.168.5.1 > 192.168.5.172: ICMP echo request, id 51210, seq 0, length 28
15:39:40.350906 ARP, Request who-has 192.168.5.172 tell 192.168.5.20, length 46
15:39:40.499246 IP 192.168.5.1.67 > 192.168.5.172.68: BOOTP/DHCP, Reply, length 300
15:39:40.681395 IP 192.168.5.1.67 > 192.168.5.172.68: BOOTP/DHCP, Reply, length 300
15:39:40.685609 ARP, Request who-has 192.168.5.172 tell 0.0.0.0, length 46
15:39:40.924583 ARP, Request who-has 192.168.5.172 tell 0.0.0.0, length 46
15:39:41.184648 ARP, Request who-has 192.168.5.172 tell 0.0.0.0, length 46
15:39:41.375926 ARP, Request who-has 192.168.5.172 tell 192.168.5.20, length 46
15:39:41.686585 IP 192.168.5.172 > 224.0.0.251: igmp v2 report 224.0.0.251
15:39:41.784812 IP 192.168.5.172 > 224.0.0.251: igmp v2 report 224.0.0.251
15:39:41.892527 IP 192.168.5.172.5353 > 224.0.0.251.5353: 0 [1n] ANY (QU)? esp32-028808.local. (52)
15:39:41.923714 ARP, Request who-has 192.168.5.172 tell 192.168.5.172, length 46
15:39:41.943746 ARP, Request who-has 192.168.5.20 tell 192.168.5.172, length 46
15:39:42.191485 IP 192.168.5.172.5353 > 224.0.0.251.5353: 0 [1n] ANY (QM)? esp32-028808.local. (52)
15:39:42.494684 IP 192.168.5.172.5353 > 224.0.0.251.5353: 0 [1n] ANY (QM)? esp32-028808.local. (52)
15:39:42.795066 IP 192.168.5.172.5353 > 224.0.0.251.5353: 0*- [0q] 1/0/0 (Cache flush) A 192.168.5.172 (46)
15:39:42.928049 ARP, Request who-has 192.168.5.172 tell 192.168.5.172, length 46
15:39:43.142873 ARP, Request who-has 192.168.5.1 tell 192.168.5.172, length 46
15:39:43.142977 ARP, Reply 192.168.5.1 is-at 78:8a:20:0d:7c:b5, length 28
15:39:43.145772 IP 192.168.5.172.58541 > 192.168.5.1.53: 11606+ A? accounts.spotify.com. (38)
15:39:43.156604 IP 192.168.5.1.53 > 192.168.5.172.58541: 11606 2/0/0 CNAME edge-web.dual-gslb.spotify.com., A 35.186.224.24 (87)
15:39:43.163161 IP 192.168.5.172.65234 > 35.186.224.24.443: Flags [S], seq 2768825769, win 5760, options [mss 1440], length 0
15:39:43.174730 IP 35.186.224.24.443 > 192.168.5.172.65234: Flags [S.], seq 1899506514, ack 2768825770, win 65535, options [mss 1412], length 0
15:39:43.179642 IP 192.168.5.172.65234 > 35.186.224.24.443: Flags [.], ack 1, win 5760, length 0
15:39:43.185975 IP 192.168.5.172.65234 > 35.186.224.24.443: Flags [P.], seq 1:246, ack 1, win 5760, length 245
15:39:43.197259 IP 35.186.224.24.443 > 192.168.5.172.65234: Flags [.], ack 246, win 65535, length 0
15:39:43.200691 IP 35.186.224.24.443 > 192.168.5.172.65234: Flags [.], seq 1:1413, ack 246, win 65535, length 1412
15:39:43.200784 IP 35.186.224.24.443 > 192.168.5.172.65234: Flags [P.], seq 1413:2049, ack 246, win 65535, length 636
15:39:43.200848 IP 35.186.224.24.443 > 192.168.5.172.65234: Flags [P.], seq 2049:3403, ack 246, win 65535, length 1354
15:39:43.204280 IP 192.168.5.172.65234 > 35.186.224.24.443: Flags [.], ack 2049, win 3712, length 0
15:39:43.207021 IP 192.168.5.172.65234 > 35.186.224.24.443: Flags [.], ack 2049, win 5760, length 0
15:39:43.403443 IP 192.168.5.172.65234 > 35.186.224.24.443: Flags [.], ack 3403, win 4406, length 0
15:39:43.614263 IP 192.168.5.172.65234 > 35.186.224.24.443: Flags [P.], seq 246:321, ack 3403, win 4406, length 75
15:39:43.630589 IP 35.186.224.24.443 > 192.168.5.172.65234: Flags [.], ack 321, win 65535, length 0
15:39:43.634152 IP 192.168.5.172.65234 > 35.186.224.24.443: Flags [P.], seq 321:372, ack 3403, win 4406, length 51
15:39:43.645212 IP 35.186.224.24.443 > 192.168.5.172.65234: Flags [.], ack 372, win 65535, length 0
15:39:43.645323 IP 35.186.224.24.443 > 192.168.5.172.65234: Flags [P.], seq 3403:3713, ack 372, win 65535, length 310
15:39:43.649978 IP 192.168.5.172.65234 > 35.186.224.24.443: Flags [.], ack 3713, win 5709, length 0
15:39:43.657146 IP 192.168.5.172.65234 > 35.186.224.24.443: Flags [P.], seq 372:427, ack 3713, win 5709, length 55
15:39:43.673309 IP 35.186.224.24.443 > 192.168.5.172.65234: Flags [.], ack 427, win 65535, length 0
15:39:43.676680 IP 192.168.5.172.65234 > 35.186.224.24.443: Flags [P.], seq 427:1261, ack 3713, win 5709, length 834
15:39:43.687722 IP 35.186.224.24.443 > 192.168.5.172.65234: Flags [.], ack 1261, win 65535, length 0
15:39:43.716640 IP 35.186.224.24.443 > 192.168.5.172.65234: Flags [P.], seq 3713:4543, ack 1261, win 65535, length 830
15:39:43.716730 IP 35.186.224.24.443 > 192.168.5.172.65234: Flags [F.], seq 4543, ack 1261, win 65535, length 0
15:39:43.721887 IP 192.168.5.172.65234 > 35.186.224.24.443: Flags [.], ack 4544, win 4878, length 0
15:39:43.775136 IP 192.168.5.172.65234 > 35.186.224.24.443: Flags [F.], seq 1261, ack 4544, win 4878, length 0
15:39:43.786166 IP 35.186.224.24.443 > 192.168.5.172.65234: Flags [.], ack 1262, win 6288, length 0
15:39:43.891046 IP 192.168.5.172.5353 > 224.0.0.251.5353: 0*- [0q] 1/0/0 (Cache flush) A 192.168.5.172 (46)
15:39:43.923688 ARP, Request who-has 192.168.5.172 tell 192.168.5.172, length 46
15:39:44.566897 ARP, Request who-has 192.168.5.172 tell 192.168.5.1, length 28
15:39:44.657525 ARP, Reply 192.168.5.172 is-at 30:ae:a4:02:88:08, length 46
15:39:44.924522 ARP, Request who-has 192.168.5.172 tell 192.168.5.172, length 46
15:39:44.991056 IP 192.168.5.172.5353 > 224.0.0.251.5353: 0*- [0q] 1/0/0 (Cache flush) A 192.168.5.172 (46)
```

**Comment by jsa91** [comment]
Any updates? I can also confirm that downgrading ESP-IDF works as a workaround.

**Comment by kopfkraft** [comment]
Using release 1.6.1 with idf v5.4.2 causes Guru Meditation Error ... the first upload works fine, even requesting ntptime works (over PPP) but the second request via https causes it to crash ...

Guru Meditation Error: Core  1 panic'ed (LoadProhibited). Exception was unhandled.

Coming form 1.5.0 the timer functionality (PERIODIC) stopped working too... 

Core  1 register dump:
PC      : 0x400e897a  PS      : 0x00060f30  A0      : 0x800e94dc  A1      : 0x3ffd7d50  
A2      : 0x3ffe1528  A3      : 0x0000ffff  A4      : 0x00000001  A5      : 0x00000000  
A6      : 0x0000004b  A7      : 0x00000000  A8      : 0x00000000  A9      : 0x3ffd7d10  
A10     : 0x00000000  A11     : 0x0000128f  A12     : 0x3ffe29e0  A13     : 0x3f8383b4  
A14     : 0x3ffe2b94  A15     : 0x3ffe29c8  SAR     : 0x00000018  EXCCAUSE: 0x0000001c  
EXCVADDR: 0x00000024  LBEG    : 0x40093bc8  LEND    : 0x40093be4  LCOUNT  : 0x00000000  


Backtrace: 0x400e8977:0x3ffd7d50 0x400e94d9:0x3ffd7d80 0x400d9985:0x3ffd7da0
